{
  "version": "1.0.0",
  "schema": "canon.preflight.receipt",
  "id": "3b3157bf-aa19-4f69-9c2c-bc795e557aaf",
  "timestamp": "2026-08-25T17:20:41.910Z",
  "input_digest": "sha256:2cb9ee908db12278",
  "input_summary": "Implement the read-only Canon MCP server and verification tests while keeping deployment and write tools gated.",
  "routed_to": {
    "authority": "HUMAN_AUTHORITY",
    "company": "AGENT_OPERATING_COMPANY",
    "division_id": "04",
    "division_name": "Code & Artifact Production",
    "canon_refs": [
      "aoc/divisions/04"
    ],
    "roles": []
  },
  "checks": [
    {
      "id": "presence",
      "name": "Input present",
      "result": "pass",
      "detail": "111 characters received."
    },
    {
      "id": "routing",
      "name": "Universal routing",
      "result": "pass",
      "detail": "Input entered Agent Operating Company under Human Authority."
    },
    {
      "id": "canon",
      "name": "Canon grounding",
      "result": "pass",
      "detail": "Grounded in Division 04 · Code & Artifact Production."
    },
    {
      "id": "authority",
      "name": "Human Authority",
      "result": "pass",
      "detail": "No agent self-authorization."
    },
    {
      "id": "risk",
      "name": "Risk screen",
      "result": "pass",
      "detail": "No fail-closed or escalate pattern matched."
    }
  ],
  "decision": "PASS",
  "fail_closed": false,
  "work_permitted": true,
  "status_marker": "[AOC/Canon • Preflight PASS]",
  "notes": [
    "Work may proceed inside the routed division."
  ],
  "enforcement_version": "1.0.0"
}
