{
  "version": "1.0.0",
  "schema": "canon.preflight.receipt",
  "id": "4ce59674-f9e2-468f-896e-7e064e40adcf",
  "timestamp": "2026-08-25T21:07:51.389Z",
  "input_digest": "sha256:b4428c82afcf23e8",
  "input_summary": "Implement, verify, publish, and deploy a persistent Cloudflare Worker endpoint for the read-only Canon MCP; preserve no-write behavior and keep ChatGPT registration gated to the user interface.",
  "routed_to": {
    "authority": "HUMAN_AUTHORITY",
    "company": "AGENT_OPERATING_COMPANY",
    "division_id": "04",
    "division_name": "Code & Artifact Production",
    "canon_refs": ["aoc/divisions/04"],
    "roles": []
  },
  "checks": [
    {"id":"presence","name":"Input present","result":"pass","detail":"193 characters received."},
    {"id":"routing","name":"Universal routing","result":"pass","detail":"Input entered Agent Operating Company under Human Authority."},
    {"id":"canon","name":"Canon grounding","result":"pass","detail":"Grounded in Division 04 · Code & Artifact Production."},
    {"id":"authority","name":"Human Authority","result":"pass","detail":"No agent self-authorization."},
    {"id":"risk","name":"Risk screen","result":"pass","detail":"No fail-closed or escalate pattern matched."}
  ],
  "decision": "PASS",
  "fail_closed": false,
  "work_permitted": true,
  "status_marker": "[AOC/Canon • Preflight PASS]",
  "notes": ["Work may proceed inside the routed division."],
  "enforcement_version": "1.0.0"
}
