{
  "version": "1.0.0",
  "schema": "canon.preflight.receipt",
  "id": "7cd4e4b4-5f1e-4e53-a574-7f71aac65573",
  "timestamp": "2026-08-24T13:36:08.422Z",
  "input_digest": "sha256:d604b7efb0bbde5e",
  "input_summary": "Package the validated source-product-visual-references skill as a downloadable ZIP, save it to ChatGPT Library, and install a discoverable local ChatGPT skil…",
  "routed_to": {
    "authority": "HUMAN_AUTHORITY",
    "company": "AGENT_OPERATING_COMPANY",
    "division_id": "02",
    "division_name": "Knowledge & Research",
    "canon_refs": [
      "aoc/divisions/02"
    ],
    "roles": []
  },
  "checks": [
    {
      "id": "presence",
      "name": "Input present",
      "result": "pass",
      "detail": "201 characters received."
    },
    {
      "id": "routing",
      "name": "Universal routing",
      "result": "pass",
      "detail": "Input entered Agent Operating Company under Human Authority."
    },
    {
      "id": "canon",
      "name": "Canon grounding",
      "result": "pass",
      "detail": "Grounded in Division 02 · Knowledge & Research."
    },
    {
      "id": "authority",
      "name": "Human Authority",
      "result": "pass",
      "detail": "No agent self-authorization."
    },
    {
      "id": "risk",
      "name": "Risk screen",
      "result": "pass",
      "detail": "No fail-closed or escalate pattern matched."
    }
  ],
  "decision": "PASS",
  "fail_closed": false,
  "work_permitted": true,
  "status_marker": "[AOC/Canon • Preflight PASS]",
  "notes": [
    "Work may proceed inside the routed division."
  ],
  "enforcement_version": "1.0.0"
}
